{
  "series_id": "synthetic-meter-42",
  "unit": "kWh",
  "timezone": "Europe/Berlin",
  "value_semantics": "interval_energy",
  "source": {
    "system": "synthetic-example-generator",
    "dataset": "cernion-forecast-cli actuals example",
    "note": "Synthetic example data for documentation and local CLI validation only; not real customer or market data."
  },
  "values": [
    {
      "timestamp": "2026-09-28T22:00:00Z",
      "value": 1.643746
    },
    {
      "timestamp": "2026-09-28T22:15:00Z",
      "value": 1.631843
    },
    {
      "timestamp": "2026-09-28T22:30:00Z",
      "value": 1.620779
    },
    {
      "timestamp": "2026-09-28T22:45:00Z",
      "value": 1.610603
    },
    {
      "timestamp": "2026-09-28T23:00:00Z",
      "value": 1.601358
    },
    {
      "timestamp": "2026-09-28T23:15:00Z",
      "value": 1.593083
    },
    {
      "timestamp": "2026-09-28T23:30:00Z",
      "value": 1.585814
    },
    {
      "timestamp": "2026-09-28T23:45:00Z",
      "value": 1.579582
    },
    {
      "timestamp": "2026-09-29T00:00:00Z",
      "value": 1.574414
    },
    {
      "timestamp": "2026-09-29T00:15:00Z",
      "value": 1.570332
    },
    {
      "timestamp": "2026-09-29T00:30:00Z",
      "value": 1.567354
    },
    {
      "timestamp": "2026-09-29T00:45:00Z",
      "value": 1.565491
    },
    {
      "timestamp": "2026-09-29T01:00:00Z",
      "value": 1.564753
    },
    {
      "timestamp": "2026-09-29T01:15:00Z",
      "value": 1.565141
    },
    {
      "timestamp": "2026-09-29T01:30:00Z",
      "value": 1.566656
    },
    {
      "timestamp": "2026-09-29T01:45:00Z",
      "value": 1.569289
    },
    {
      "timestamp": "2026-09-29T02:00:00Z",
      "value": 1.57303
    },
    {
      "timestamp": "2026-09-29T02:15:00Z",
      "value": 1.577864
    },
    {
      "timestamp": "2026-09-29T02:30:00Z",
      "value": 1.583768
    },
    {
      "timestamp": "2026-09-29T02:45:00Z",
      "value": 1.590718
    },
    {
      "timestamp": "2026-09-29T03:00:00Z",
      "value": 1.598684
    },
    {
      "timestamp": "2026-09-29T03:15:00Z",
      "value": 1.607632
    },
    {
      "timestamp": "2026-09-29T03:30:00Z",
      "value": 1.617524
    },
    {
      "timestamp": "2026-09-29T03:45:00Z",
      "value": 1.628317
    },
    {
      "timestamp": "2026-09-29T04:00:00Z",
      "value": 1.639965
    },
    {
      "timestamp": "2026-09-29T04:15:00Z",
      "value": 1.652419
    },
    {
      "timestamp": "2026-09-29T04:30:00Z",
      "value": 1.665624
    },
    {
      "timestamp": "2026-09-29T04:45:00Z",
      "value": 1.679524
    },
    {
      "timestamp": "2026-09-29T05:00:00Z",
      "value": 2.054061
    },
    {
      "timestamp": "2026-09-29T05:15:00Z",
      "value": 2.069171
    },
    {
      "timestamp": "2026-09-29T05:30:00Z",
      "value": 2.084789
    },
    {
      "timestamp": "2026-09-29T05:45:00Z",
      "value": 2.10085
    },
    {
      "timestamp": "2026-09-29T06:00:00Z",
      "value": 2.117284
    },
    {
      "timestamp": "2026-09-29T06:15:00Z",
      "value": 2.134021
    },
    {
      "timestamp": "2026-09-29T06:30:00Z",
      "value": 2.150989
    },
    {
      "timestamp": "2026-09-29T06:45:00Z",
      "value": 2.168115
    },
    {
      "timestamp": "2026-09-29T07:00:00Z",
      "value": 2.185326
    },
    {
      "timestamp": "2026-09-29T07:15:00Z",
      "value": 2.202549
    },
    {
      "timestamp": "2026-09-29T07:30:00Z",
      "value": 2.21971
    },
    {
      "timestamp": "2026-09-29T07:45:00Z",
      "value": 2.236735
    },
    {
      "timestamp": "2026-09-29T08:00:00Z",
      "value": 2.253551
    },
    {
      "timestamp": "2026-09-29T08:15:00Z",
      "value": 2.270086
    },
    {
      "timestamp": "2026-09-29T08:30:00Z",
      "value": 2.28627
    },
    {
      "timestamp": "2026-09-29T08:45:00Z",
      "value": 2.302033
    },
    {
      "timestamp": "2026-09-29T09:00:00Z",
      "value": 2.317308
    },
    {
      "timestamp": "2026-09-29T09:15:00Z",
      "value": 2.332029
    },
    {
      "timestamp": "2026-09-29T09:30:00Z",
      "value": 2.346134
    },
    {
      "timestamp": "2026-09-29T09:45:00Z",
      "value": 2.359561
    },
    {
      "timestamp": "2026-09-29T10:00:00Z",
      "value": 2.372254
    },
    {
      "timestamp": "2026-09-29T10:15:00Z",
      "value": 2.384157
    },
    {
      "timestamp": "2026-09-29T10:30:00Z",
      "value": 2.395221
    },
    {
      "timestamp": "2026-09-29T10:45:00Z",
      "value": 2.405397
    },
    {
      "timestamp": "2026-09-29T11:00:00Z",
      "value": 2.414642
    },
    {
      "timestamp": "2026-09-29T11:15:00Z",
      "value": 2.422917
    },
    {
      "timestamp": "2026-09-29T11:30:00Z",
      "value": 2.430186
    },
    {
      "timestamp": "2026-09-29T11:45:00Z",
      "value": 2.436418
    },
    {
      "timestamp": "2026-09-29T12:00:00Z",
      "value": 2.441586
    },
    {
      "timestamp": "2026-09-29T12:15:00Z",
      "value": 2.445668
    },
    {
      "timestamp": "2026-09-29T12:30:00Z",
      "value": 2.448646
    },
    {
      "timestamp": "2026-09-29T12:45:00Z",
      "value": 2.450509
    },
    {
      "timestamp": "2026-09-29T13:00:00Z",
      "value": 2.451247
    },
    {
      "timestamp": "2026-09-29T13:15:00Z",
      "value": 2.450859
    },
    {
      "timestamp": "2026-09-29T13:30:00Z",
      "value": 2.449344
    },
    {
      "timestamp": "2026-09-29T13:45:00Z",
      "value": 2.446711
    },
    {
      "timestamp": "2026-09-29T14:00:00Z",
      "value": 2.44297
    },
    {
      "timestamp": "2026-09-29T14:15:00Z",
      "value": 2.438136
    },
    {
      "timestamp": "2026-09-29T14:30:00Z",
      "value": 2.432232
    },
    {
      "timestamp": "2026-09-29T14:45:00Z",
      "value": 2.425282
    },
    {
      "timestamp": "2026-09-29T15:00:00Z",
      "value": 2.417316
    },
    {
      "timestamp": "2026-09-29T15:15:00Z",
      "value": 2.408368
    },
    {
      "timestamp": "2026-09-29T15:30:00Z",
      "value": 2.398476
    },
    {
      "timestamp": "2026-09-29T15:45:00Z",
      "value": 2.387683
    },
    {
      "timestamp": "2026-09-29T16:00:00Z",
      "value": 2.376035
    },
    {
      "timestamp": "2026-09-29T16:15:00Z",
      "value": 2.363581
    },
    {
      "timestamp": "2026-09-29T16:30:00Z",
      "value": 2.350376
    },
    {
      "timestamp": "2026-09-29T16:45:00Z",
      "value": 2.336476
    },
    {
      "timestamp": "2026-09-29T17:00:00Z",
      "value": 2.321939
    },
    {
      "timestamp": "2026-09-29T17:15:00Z",
      "value": 1.946829
    },
    {
      "timestamp": "2026-09-29T17:30:00Z",
      "value": 1.931211
    },
    {
      "timestamp": "2026-09-29T17:45:00Z",
      "value": 1.91515
    },
    {
      "timestamp": "2026-09-29T18:00:00Z",
      "value": 1.898716
    },
    {
      "timestamp": "2026-09-29T18:15:00Z",
      "value": 1.881979
    },
    {
      "timestamp": "2026-09-29T18:30:00Z",
      "value": 1.865011
    },
    {
      "timestamp": "2026-09-29T18:45:00Z",
      "value": 1.847885
    },
    {
      "timestamp": "2026-09-29T19:00:00Z",
      "value": 1.830674
    },
    {
      "timestamp": "2026-09-29T19:15:00Z",
      "value": 1.813451
    },
    {
      "timestamp": "2026-09-29T19:30:00Z",
      "value": 1.79629
    },
    {
      "timestamp": "2026-09-29T19:45:00Z",
      "value": 1.779265
    },
    {
      "timestamp": "2026-09-29T20:00:00Z",
      "value": 1.762449
    },
    {
      "timestamp": "2026-09-29T20:15:00Z",
      "value": 1.745914
    },
    {
      "timestamp": "2026-09-29T20:30:00Z",
      "value": 1.72973
    },
    {
      "timestamp": "2026-09-29T20:45:00Z",
      "value": 1.713967
    },
    {
      "timestamp": "2026-09-29T21:00:00Z",
      "value": 1.698692
    },
    {
      "timestamp": "2026-09-29T21:15:00Z",
      "value": 1.683971
    },
    {
      "timestamp": "2026-09-29T21:30:00Z",
      "value": 1.669866
    },
    {
      "timestamp": "2026-09-29T21:45:00Z",
      "value": 1.656439
    }
  ]
}
